{
  "schema": "wi9-authorship-2",
  "document": {
    "path": "draft.txt",
    "origin": "human_authored",
    "arena": "journalism",
    "venue_policy": "human_only",
    "intended_use": "submission",
    "expected_sha256": "9276fd959d1a787dfd46b16e24f8a7778c4cfcc68b6e74697525a3bbae77c51c"
  },
  "venue_contract": {
    "venue": "Synthetic Reporter Desk",
    "allowed_assistance": [
      "mechanical_proofread"
    ],
    "allowed_operations": [
      "research",
      "submit"
    ]
  },
  "contribution_log": [
    {
      "kind": "human_original"
    }
  ],
  "evidence": [
    {
      "id": "e1",
      "claim": "The author rebuilt the bridge twice.",
      "kind": "firsthand",
      "source_path": "notes.txt",
      "sha256": "554948aab75aba0d9cbb185b3fb3a77d03ee2674fb8da5d0f31eb2eede9526cb",
      "exact_excerpt": "I rebuilt the model bridge twice in March because the first glue joint sheared.",
      "source_origin": "human_authored",
      "experience_state": "observed",
      "consent": true
    }
  ],
  "document_claim_anchors": [
    {
      "exact_excerpt": "I rebuilt the model bridge twice in March because the first glue joint sheared.",
      "evidence_id": "e1"
    }
  ],
  "voice_samples": []
}